"id","title","categories","year","players_min","players_max","playtime_min","playtime_max","thumbnail_url","created_at","bgg_id","thumbnail_file","mana_meeple_category","description","designers","publishers","mechanics","artists","average_rating","complexity","bgg_rank","users_rated","min_age","is_cooperative","image","nz_designer","game_type","date_added","status","is_expansion","base_game_id","expansion_type","modifies_players_min","modifies_players_max","has_sleeves"
38,Hues and Cues,"Deduction, Party Game",2020,3,10,30,30,/thumbs/38-hues-and-cues.jpg,2025-09-16 22:42:44.843,302520,"38-hues-and-cues.jpg",PARTY_ICEBREAKERS,"What hue do you think of when we say “apple”? Hues and Cues is a vibrant game of colorful communication where players are challenged to make connections to colors with words. Using only one and two-word cues, players try to get others to guess a specific hue from the 480 colors on the game board. The closer the guesses are to the target, the more points you earn. Since everyone imagines colors differently, connecting colors and clues has never been this much fun!

Gather around with three to ten people to play a quick and simple game with a prism of possibilities! First, a “cue giver” hides a specific color they’ve chosen out of a deck of cards. There are 480 shades on the board in front of you! After getting one- and two-word cues, everyone places their marker on which color they think is being described. “Coffee.” Is it dark brown, as in freshly brewed? “Au lait.” With milk. That means I should pick a lighter shade!

Use examples from everyday life, from nature to pop culture, or materials and moods. Everyone around the table gets a turn to give cues and guess. The better your hints or guesses, the more points you earn. Play off others' experiences to narrow down what they have in mind!

—description from the publisher

","[""Scott Brady""]","[""The Op Games"", ""CMON Global Limited"", ""Grok Games"", ""Lanlalen"", ""Ludopolis""]","[""Communication Limits"", ""Deduction"", ""Score-and-Reset Game"", ""Targeted Clues"", ""Turn Order: Progressive""]",[],6.49431,1.0682,2323,6058,8,false,https://cf.geekdo-images.com/jdR8WW75HkaoHGMTCIx9lA__original/img/i8nlw_c9CYgJMzixadYVh7GTTPc=/0x0/filters:format(jpeg)/pic5390676.jpg,false,Party • Family,2025-07-01 00:00:00.000,OWNED,false,,,,,
40,King of Tokyo,"Dice, Fighting, Movies / TV / Radio theme, Science Fiction",2011,2,6,30,30,/thumbs/40-king-of-tokyo.jpg,2025-09-16 22:42:48.949,70323,"40-king-of-tokyo.jpg",GATEWAY_STRATEGY,"In King of Tokyo, you play mutant monsters, gigantic robots, and strange aliens—all of whom are destroying Tokyo and whacking each other in order to become the one and only King of Tokyo.

At the start of each turn, you roll six dice, which show the following six symbols: 1, 2, or 3 Victory Points, Energy, Heal, and Attack. Over three successive throws, choose whether to keep or discard each die in order to win victory points, gain energy, restore health, or attack other players into understanding that Tokyo is YOUR territory.

The fiercest player will occupy Tokyo, and earn extra victory points, but that player can't heal and must face all the other monsters alone!

Top this off with special cards purchased with energy that have a permanent or temporary effect, such as the growing of a second head which grants you an additional die, body armor, nova death ray, and more.... and it's one of the most explosive games of the year!

In order to win the game, one must either destroy Tokyo by accumulating 20 victory points, or be the only surviving monster once the fighting has ended.

First Game in the King of Tokyo series

","[""Richard Garfield""]","[""IELLO"", ""Boardgame Space"", ""Brain Games"", ""Bureau de Juegos"", ""Delta Vision Publishing"", ""Devir"", ""Egmont Polska"", ""Enigma (Bergsala Enigma)"", ""Fantasmagoria"", ""GaGa Games"", ""Galu00e1pagos Jogos"", ""GeGe Co. Ltd."", ""GoKids u73a9u6a02u5c0fu5b50"", ""HaKubia"", ""Heidelberger Spieleverlag"", ""Hobby Japan"", ""Hobby World"", ""HomoLudicus"", ""Kaissa Chess & Games"", ""Korea Boardgames"", ""Lautapelit.fi"", ""Lex Games"", ""Mancalamaro"", ""MESAboardgames"", ""MIPL"", ""Nordic Games ehf"", ""Origames"", ""Portal Games"", ""Reflexshop"", ""REXhry"", ""Siam Board Games"", ""Smart Ltd"", ""uplay.it edizioni"", ""Venneru00f8d Forlag AS"", ""u0406u0433u0440u043eu043cu0430u0433""]","[""Dice Rolling"", ""Die Icon Resolution"", ""King of the Hill"", ""Open Drafting"", ""Player Elimination"", ""Push Your Luck"", ""Re-rolling and Locking"", ""Take That""]","[""Gabriel Butik"", ""Romain Gaschet"", ""Paul Mafayon"", ""Igor Polouchine"", ""Benjamin Raynal"", ""Jean-Baptiste Reynaud"", ""Jonathan Silvestre"", ""Ru00e9gis Torres"", ""Anthony Wolff""]",7.12042,1.4859,467,74279,8,false,https://cf.geekdo-images.com/m_RzXpHURC0_xLkvRSR_sw__original/img/hSvWgiRYJCTTuoLOWTW3c8sYtl8=/0x0/filters:format(jpeg)/pic3043734.jpg,false,Family,2025-07-01 00:00:00.000,OWNED,false,,,,,
73,Viticulture Essential Edition,"Economic, Farming",2015,1,6,45,90,/thumbs/73-viticulture-essential-edition.jpg,2025-09-16 22:44:01.067,183394,"73-viticulture-essential-edition.jpg",CORE_STRATEGY,"In Viticulture, the players find themselves in the roles of people in rustic, pre-modern Tuscany who have inherited meagre vineyards. They have a few plots of land, an old crush pad, a tiny cellar, and three workers. They each have a dream of being the first to call their winery a true success.

The players are in the position of determining how they want to allocate their workers throughout the year. Every season is different on a vineyard, so the workers have different tasks they can take care of in the summer and winter. There's competition over those tasks, and often the first worker to get to the job has an advantage over subsequent workers.

Fortunately for the vineyard owners, people love to visit wineries, and it just so happens that many of those visitors are willing to help out around the vineyard when they visit as long as you assign a worker to take care of them. Their visits (in the form of cards) are brief but can be very helpful. Using those workers and visitors, the vineyard owners can expand their vineyards by building structures, planting vines, and filling wine orders, working towards the goal of running the most successful winery in Tuscany.

Viticulture Essential Edition includes the base game of Viticulture and a few of the most popular modules from the original Tuscany expansion, including Mamas & Papas, Fields (previously known as Properties), expanded and revised Visitors, and Automa cards for a solo variant, along with a few minor rule changes.

","[""Jamey Stegmaier"", ""Alan Stone""]","[""Stonemaier Games"", ""Albi"", ""Angry Lion Games"", ""Arclight Games"", ""Board Game Rookie"", ""Delta Vision Publishing"", ""Feuerland Spiele"", ""Ghenos Games"", ""Kilogames"", ""Korea Boardgames"", ""Lavka Games"", ""Ludofy Creative"", ""Maldito Games"", ""Matagot"", ""PHALANX"", ""Regatul Jocurilor"", ""Surfin' Meeple China"", ""Tower Tactic Games""]","[""Contracts"", ""Hand Management"", ""Race"", ""Solo / Solitaire Game"", ""Turn Order: Auction"", ""Victory Points as a Resource"", ""Worker Placement"", ""Worker Placement, Different Worker Types""]","[""Jacqui Davis"", ""David Montgomery"", ""Beth Sobel""]",7.96753,2.895,43,53207,13,false,https://cf.geekdo-images.com/l_PRU2lVlX9seScRFcvFlA__original/img/gDL7OZFlzoOFgU0VYlREs8P5hCQ=/0x0/filters:format(jpeg)/pic6500949.jpg,false,Strategy,2025-07-01 00:00:00.000,OWNED,false,,,,,
41,KLASK,"Action / Dexterity, Real-time",2014,2,2,10,10,/thumbs/41-klask.png,2025-09-16 22:42:51.122,165722,"41-klask.png",KIDS_FAMILIES,"The KLASK game board is shaped like a ball field with two deep holes functioning as goals in each end of the field. In the middle of the field, three white magnetic pieces serve as ""obstacles"" – do NOT attract them to your own gaming piece! Your gaming piece is a black magnet. You control it by holding a large magnet under the board. This magnet is connected to a small magnet placed on the field. The purpose of the game is to push the small, red ball around on the field with your magnet/gaming piece, shoot the ball past the obstacles and your opponent and into the goal hole (Klask). It’s so much fun when your opponent suddenly is covered in white obstacles or you drop your gaming piece into the goal – something which might happen if you get a little too eager!

Place the game board on a table between the two players. Place the three white magnetic pieces on the white fields on the board. Put two coins in each point slot next to the ""0"". Each player has a black magnetic gaming piece in two parts. Place the short (thin) part on top of the board and the long (thick) part under the board in such a way, so the two parts “catch” each other. Place the ball in the corner start field. Steer it with the black gaming pieces.

The youngest player starts the game. You score a point if:


    The ball ends in your opponent's hole and stays in the hole.
    Two or all of the three white magnetic pieces stick to your opponent's gaming piece.
    The opponent accidentally pulls their gaming piece into their own goal hole.
    If the opponent loses their gaming piece.


Each time you get a point, you must move your coin one point forward in the point slot. The player who first reaches the KLASK field wins.

During the game:


    If one of the white magnetic pieces sticks to a gaming piece, the game continues; if two of the white magnetic pieces stick to one gaming piece, the opponent gets one point.
    If the ball falls over the edges of the board, you must place the ball in the co","[""Mikkel Bertelsen""]","[""Klask ApS"", ""Big Potato Games"", ""Boardgame Space"", ""Brain Games"", ""CLD Distributing"", ""Competo / Marektoy"", ""Dino Toys s. r. o."", ""FantasTies"", ""FoxMind"", ""G3"", ""Game Factory"", ""Ghenos Games"", ""Gigamic"", ""InterHit"", ""Korea Boardgames"", ""Lord of Boards"", ""MEBO Games"", ""Reflexshop"", ""Regatul Jocurilor"", ""VR Distribution""]","[""Real-Time"", ""Score-and-Reset Game""]","[""Mikkel Bertelsen""]",7.62718,1.0485,254,11699,8,false,https://cf.geekdo-images.com/oPNuEm_dR987BKoYEF9zGQ__original/img/ZNqEkLMKkrIPxRduZWmWC6VBgoY=/0x0/filters:format(png)/pic7414566.png,false,Party • Family,2025-07-01 00:00:00.000,OWNED,false,,,,,
42,Leaping Lemmings,"Animals, Humor",2010,2,6,60,72,/thumbs/42-leaping-lemmings.jpg,2025-09-16 22:42:53.827,29687,"42-leaping-lemmings.jpg",GATEWAY_STRATEGY,"Leaping Lemmings - The Original Cliff Divers

Leaping Lemmings is a humorous game for 2-6 players. Each player controls a cloned clan of lemmings that have been specially trained to compete with the other lemming clans, all trying to scurry down a canyon and hurl themselves over a cliff. Distance and style points are important. One lemming diving with style and élan is worth as many as five of the more mundane divers. But beware the hungry eagles circling overhead or your lemmings might not even make the cliff edge!

Objective: The player with the most victory points wins the game. To earn victory points, players dive their lemmings over the cliff edge and/or collect Lemming Chow Pellets.

The game board is a hex-based map representing the canyon down which up to six separate lemming clans will travel. The canyon ends with the cliff edge hexes, which are the lemmings' ultimate goal. Between the lemmings and their goal there are two eagles circling overhead hoping for multiple lemming snacks.

Each turn a movement card is revealed which will allow for 2-5 lemming movement points. Card luck is mitigated in that all players use the same card to move that turn. Only the top lemming in each stack is allowed to move, so covering your opponents' lemmings is one tactic that is used to slow them down. The down side is that the top lemming in each stack is the only one in danger of becoming eagle chow.

Special Actions allow players to briefly alter the normal rules of the game to their advantage or to their opponents' detriment. There are 16 different Special Actions in the game.

Home Page: http://www.gmtgames.com/p-143-leaping-lemmings.aspx

","[""John Poniske"", ""Rick Young""]","[""GMT Games""]","[""Dice Rolling"", ""Grid Movement"", ""Hand Management"", ""Hexagon Grid"", ""Push Your Luck"", ""Race"", ""Take That""]","[""Rajim Harris"", ""Rodger B. MacGowan"", ""Leona Preston"", ""Mark Simonitch""]",6.41239,1.8455,4347,1270,13,false,https://cf.geekdo-images.com/a4iXNnKmRMGJPimWki6T_w__original/img/ti-q16xwJv-Sw5DG4tVvQEdM-e4=/0x0/filters:format(jpeg)/pic7047121.jpg,false,Family,2025-07-01 00:00:00.000,OWNED,false,,,,,
43,Drop It,Action / Dexterity,2018,2,4,30,30,/thumbs/43-drop-it.jpg,2025-09-16 22:42:56.042,244916,"43-drop-it.jpg",KIDS_FAMILIES,"Circles, triangles, squares and diamonds: Drop It is about letting go, with the pieces you drop landing somewhere in the vertical game board, ideally where they'll score the most points, but the tiles bounce around and don't always land where you expect them to!

In more detail, each turn the active player drops one of their pieces into the slot of the game board. The player scores points for the highest level that the piece touches and for any special locations that it touches, but if the piece touches anything of the same shape or color, then you score nothing! What's more, certain pieces are forbidden at certain spots on the edge of the playing area.

The Drop It rulebook includes variant rules for simpler play or more variety from game to game.

","[""Bernhard Lach"", ""Uwe Rapp""]","[""KOSMOS"", ""999 Games"", ""Albi"", ""Spilbru00e6t.dk"", ""Thames & Kosmos"", ""Venneru00f8d Forlag AS""]",[],"[""Fiore GmbH"", ""Andreas Resch""]",6.88471,1.0877,1841,3118,8,false,https://cf.geekdo-images.com/CwlOEAEzD-O09vdbvyD2Gw__original/img/C9b_1Wjp5-1m8AnaKlYrWmnB6NA=/0x0/filters:format(jpeg)/pic7988716.jpg,false,Family,2025-07-01 00:00:00.000,OWNED,false,,,,,
45,Floating Floors,"Abstract Strategy, Action / Dexterity, Maze, Print & Play",2023,2,4,20,40,/thumbs/45-floating-floors.jpg,2025-09-16 22:43:01.092,334712,"45-floating-floors.jpg",KIDS_FAMILIES,"Floating Floors is a tactical balancing duel in which you, a ninja, become the architect of your own domain, creating a labyrinth of floating floorboards for your rival to cross.

In more detail, you create a stable path to your target by balancing a labyrinth of floorboards that will also be used by your rival. The trick is in strategically using your jutsu tokens to keep your new ninja camouflaged with the surroundings, while sabotaging the rival ninja's path.

The first ninja to claim all four bansen seals, concealed by your rival during set-up, wins.

","[""Takashi Sawada""]","[""Guf Studios"", ""CardLords"", ""Randomskill Games""]","[""Action / Event"", ""Map Addition"", ""Prisoner's Dilemma"", ""Resource to Move"", ""Team-Based Game"", ""Three Dimensional Movement""]","[""Gong Studios"", ""Jovial Graphics""]",6.723,2.0,10950,149,12,false,https://cf.geekdo-images.com/kmangN-29sLNmYfjkeUOVg__original/img/d1aOu-WBA84Xj199EkRPtlOb5wA=/0x0/filters:format(jpeg)/pic6372326.jpg,false,Dexterity,2025-07-01 00:00:00.000,OWNED,false,,,,,
46,Fort,Card Game,2020,2,4,20,40,/thumbs/46-fort.png,2025-09-16 22:43:03.422,296912,"46-fort.png",GATEWAY_STRATEGY,"Fort is a 2-4 player card game about building forts and following friends.

In Fort, you're a kid! And like many kids, you want to grow your circle of friends, collect pizza and toys, and build the coolest fort.

By doing this cool stuff, you'll score victory points, and at the end of the game, the player with the most victory points wins! Your cards not only let you take actions on your own turn, but also let you follow the other players' actions on their turns. Will you devote yourself to your own posse, or copy what the other kids are doing?

But be careful as your carefully constructed deck might start losing cards if you don't actually use them. After all, if you don't play with your friends, why should they hang out with you anymore?

—description from the publisher

","[""Grant Rodiek""]","[""Leder Games"", ""2Tomatoes Games"", ""CrowD Games"", ""Delta Vision Publishing"", ""Fox in the Box"", ""Matagot"", ""MeepleBR"", ""MS Edizioni"", ""Portal Games""]","[""Deck, Bag, and Pool Building"", ""Follow"", ""Hand Management"", ""Race"", ""Turn Order: Progressive""]","[""Kyle Ferrin""]",7.07024,2.4396,780,11287,10,false,https://cf.geekdo-images.com/hAsqLdANmtExR5Zi41v94Q__original/img/YSzUnMqcnTg-mSk8VEnBQaRRmJU=/0x0/filters:format(png)/pic5241325.png,false,Strategy,2025-07-01 00:00:00.000,OWNED,false,,,,,
47,My City,City Building,2020,2,4,30,30,/thumbs/47-my-city.jpg,2025-09-16 22:43:05.493,295486,"47-my-city.jpg",GATEWAY_STRATEGY,"My City is a competitive legacy game in which you develop a city on your own playing board through the ages.

The game consists of 24 episodes, beginning with the development of a city in its early preindustrial stages and progressing through industrialization. During each game, players customize their experience by adding elements to their personal boards and adding cards to the game. Players' choices and action made during one session of gameplay carry over into the next session, creating a personalized gaming experience.

For players who do not want to experience My City as a legacy game, a double-sided game board offers an alternate set-up for repeatable play (some elements from the legacy experience are needed for the repeatable play game, players can unlock these elements by playing through the first 4 episodes).

","[""Reiner Knizia""]","[""KOSMOS"", ""999 Games"", ""Arclight Games"", ""Broadway Toys LTD"", ""Devir"", ""Galakta"", ""Giochi Uniti"", ""IELLO"", ""Kaissa Chess & Games"", ""Korea Boardgames"", ""Lautapelit.fi"", ""Piatnik"", ""Thames & Kosmos"", ""Zvezda""]","[""Bingo"", ""Catch the Leader"", ""Grid Coverage"", ""Legacy Game"", ""Pattern Building"", ""Scenario / Mission / Campaign Game"", ""Tile Placement""]","[""Michael Menzel""]",7.59682,1.9807,257,12665,10,false,https://cf.geekdo-images.com/fz4aYmycg9baQlm_DzwyKA__original/img/TvWwknCLoPNxx3uIOhlCg-9F1mM=/0x0/filters:format(jpeg)/pic7443423.jpg,false,Family • Strategy,2025-07-01 00:00:00.000,OWNED,false,,,,,
48,Heat: Pedal to the Metal,"Racing, Sports",2022,1,6,30,60,/thumbs/48-heat-pedal-to-the-metal.png,2025-09-16 22:43:07.494,366013,"48-heat-pedal-to-the-metal.png",GATEWAY_STRATEGY,"Based on simple and intuitive hand management, Heat: Pedal to the Metal puts players in the driver's seat of intense car races, jockeying for position to cross the finish line first, while managing their car's speed if they don't want to overheat. Selecting the right upgrades for their car will help them hug the curves and keep their engine cool enough to maintain top speeds. Ultimately, their driving skills will be the key to victory!

Drivers can compete in a single race or use the ""Championship System"" to play a whole season in one game night, customizing their car before each race to claim the top spot of the podium. They have to be careful as the weather, road conditions, and events will change every race to spice up their championship. Players can also enjoy a solo mode with the Legends Module or add automated drivers as additional opponents in multiplayer games.

—description from the publisher

","[""Asger Harding Granerud"", ""Daniel Skjold Pedersen""]","[""Days of Wonder"", ""ADC Blackfire Entertainment"", ""CoolPlay"", ""Galu00e1pagos Jogos"", ""Gu00e9m Klub Kft."", ""GoKids u73a9u6a02u5c0fu5b50"", ""Hobby Japan"", ""Hobby World"", ""Kaissa Chess & Games"", ""Korea Boardgames"", ""Lord of Boards""]","[""Catch the Leader"", ""Deck, Bag, and Pool Building"", ""Hand Management"", ""Programmed Movement"", ""Push Your Luck"", ""Race"", ""Simulation"", ""Simultaneous Action Selection"", ""Solo / Solitaire Game"", ""Track Movement"", ""Variable Set-up""]","[""Vincent Dutrait""]",8.01085,2.2028,45,35241,10,false,https://cf.geekdo-images.com/-vOrd4bOspibyohYExLqWg__original/img/iXU8a9WaVlwrkiEiOxWN06y9y5g=/0x0/filters:format(png)/pic6940449.png,false,Family,2025-07-01 00:00:00.000,OWNED,false,,,,,
49,Nemesis,"Adventure, Horror, Miniatures, Science Fiction",2018,1,5,90,180,/thumbs/49-nemesis.png,2025-09-16 22:43:09.492,167355,"49-nemesis.png",COOP_ADVENTURE,"Playing Nemesis will take you into the heart of sci-fi survival horror in all its terror. A soldier fires blindly down a corridor, trying to stop the alien advance. A scientist races to find a solution in his makeshift lab. A traitor steals the last escape pod in the very last moment. Intruders you meet on the ship are not only reacting to the noise you make but also evolve as the time goes by. The longer the game takes, the stronger they become. During the game, you control one of the crew members with a unique set of skills, personal deck of cards, and individual starting equipment. These heroes cover all your basic SF horror needs. For example, the scientist is great with computers and research, but will have a hard time in combat. The soldier, on the other hand...

Nemesis is a semi-cooperative game in which you and your crewmates must survive on a ship infested with hostile organisms. To win the game, you have to complete one of the two objectives dealt to you at the start of the game and get back to Earth in one piece. You will find many obstacles on your way: swarms of Intruders (the name given to the alien organisms by the ship AI), the poor physical condition of the ship, agendas held by your fellow players, and sometimes just cruel fate.

The gameplay of Nemesis is designed to be full of climactic moments which, hopefully, you will find rewarding even when your best plans are ruined and your character meets a terrible fate.

","[""Adam Kwapiu0144ski""]","[""Awaken Realms"", ""Rebel Sp. z o.o."", ""Arclight Games"", ""asmodee"", ""Cranio Creations"", ""Delta Vision Publishing"", ""Funforge"", ""Galu00e1pagos Jogos"", ""Geekach LLC"", ""Hobby World"", ""Korea Boardgames"", ""MINDOK"", ""Rebel Studio""]","[""Campaign / Battle Card Driven"", ""Cooperative Game"", ""Dice Rolling"", ""Hand Management"", ""Hidden Roles"", ""Interrupts"", ""Modular Board"", ""Player Elimination"", ""Semi-Cooperative Game"", ""Solo / Solitaire Game"", ""Team-Based Game"", ""Traitor Game"", ""Variable Player Powers""]","[""Piotr Foksowicz"", ""Patryk Ju0119draszek"", ""Ewa Labak"", ""Andrzej Pu00f3u0142toranos""]",8.25488,3.4811,23,35219,12,true,https://cf.geekdo-images.com/4KSmlm59w0GwLIlgDnJDAQ__original/img/f0VmAKrPrMRQOUcOJHekRvuysDE=/0x0/filters:format(png)/pic8211747.png,false,Thematic,2025-07-01 00:00:00.000,OWNED,false,,,,,
50,Magic Maze,"Exploration, Fantasy, Maze, Real-time",2017,1,8,15,15,/thumbs/50-magic-maze.jpg,2025-09-16 22:43:11.600,209778,"50-magic-maze.jpg",COOP_ADVENTURE,"Description from the publisher:

After being stripped of all their possessions, a mage, a warrior, an elf, and a dwarf are forced to go rob the local Magic Maze shopping mall for all the equipment necessary for their next adventure. They agree to map out the labyrinth in its entirety first, then find each individual’s favorite store, and then locate the exit. In order to evade the surveillance of the guards who eyed their arrival suspiciously, all four will pull off their heists simultaneously, then dash to the exit. That's the plan anyway…but can they pull it off?

Magic Maze is a real-time, cooperative game. Each player can control any hero in order to make that hero perform a very specific action, to which the other players do not have access: Move north, explore a new area, ride an escalator… All this requires rigorous cooperation between the players in order to succeed at moving the heroes prudently. However, you are allowed to communicate only for short periods during the game; the rest of the time, you must play without giving any visual or audio cues to each other. If all of the heroes succeed in leaving the shopping mall in the limited time allotted for the game, each having stolen a very specific item, then everyone wins together.

At the start of the game, you have only three minutes in which to take actions. Hourglass spaces you encounter along the way give you more time. If the sand timer ever completely runs out, all players lose the game: Your loitering has aroused suspicion, and the mall security guards nab you!

","[""Kasper Lapp""]","[""Sit Down!"", ""2Tomatoes Games"", ""Broadway Toys LTD"", ""Conclave Editora"", ""Dude Games"", ""Fantasmagoria"", ""Gu00e9m Klub Kft."", ""Ghenos Games"", ""Korea Boardgames"", ""Lacerta"", ""Lautapelit.fi"", ""Lifestyle Boardgames Ltd"", ""Pegasus Spiele"", ""REXhry"", ""VR Distribution"", ""WoodCat"", ""u05e4u05e8u05e9 u05deu05e9u05d7u05e7u05d9u05dd: Game Knight""]","[""Communication Limits"", ""Cooperative Game"", ""Elapsed Real Time Ending"", ""Grid Movement"", ""Map Addition"", ""Modular Board"", ""Real-Time"", ""Scenario / Mission / Campaign Game"", ""Solo / Solitaire Game"", ""Variable Player Powers""]","[""Gyom""]",6.94117,1.7469,766,23209,8,true,https://cf.geekdo-images.com/wJfDIveg2zpTGn8E1WzEpA__original/img/hlp96WuBfwiCijcfPddNmfgTq6E=/0x0/filters:format(jpeg)/pic3268473.jpg,false,Family,2025-07-01 00:00:00.000,OWNED,false,,,,,
